"3","와사비","그냥 그래요. 서버는 외국인이 보심. 감자전 기름맛 많이 나고 별로였어요 가장자리만 맛있음 옥수수동동주는 가격 5천원으로 올랐는데 업데이트가 안됐네요. 여기보다 학사평길 쪽 ㅊㅇ손두부가 더 맛있네요.","2019.12.28."
"2","ㄱㄷㅇ","속초해변 가려다가 주차자리가 없어서 우연히 가게되었어요. 주차장은 넓지 않지만, 무료입니다. 다만, 해변 자체는 크게 좋지는 않습니다. 모래사장이 너무 가파르고, 좁습니다.","2020.07.20."
"4","뽠따스틱 갱군","개인적으로 참 좋아하는 해변. 게도 잡을 수 있고 모래도 굵고. 정감가는 해변이다.","2020.07.04."
"3","맛있는거 죠아","코스가 길지 않아 짧게 산책하면서 바다 보기 너무 좋음","2020.05.04."
"4","flow","바다향기로로","2019.09.18."
"1",".","이번에 국내 여행 속초 (외옹치항 해변) 갔다가 해변가에 파라솔 듬성듬성도 아니고 해변가 앞에 빽빽히 꽂아두고 빈 자리에 앉지도 못하게하면서 진로 방해된다며 욕하면서 시비거는거 경험하고 다시는 국내 여행 안가가로 마음먹음. 자연 경치를 가지고 돈벌이 수단으로 이용하는 사람들. 생계수단이라는데 그래 이해한다고 치고 근데 도대체 파라솔을 설치하려면 그냥 돗자리...더보기","2019.08.15."
"3","송 희경","사진은. 늘 그럴싸하게. 찍어놔서 ㅎㅎ  주인분들은 좋아요. 지하주차장은 없어요.","2020.01.25."
"1","봄가을뚱뎅이","1인당 10만원의 폭리를 취함","2016.08.14."
"5","은평금천","일 때문에 토욜 새벽늦게 도착했는데 편하세 있게끔 배려해 주시고ㄱㅅ","2016.01.20."
"5","shawn","위치좋고 친절하고 깔끔합니다.","2020.12.19."
"2","주동윤","모기가넘많아서  많이물렸어요 11월인데..  왤케  방안이  덥죠   개별난방이안되나봐요 그래서 창문을 열면 개가 왈왈오라르르와르내목소리보가더커  에어컨은 소음좀나영","2020.11.22."
"4","재형","위치도 좋고 깨끗","2020.10.24."
"5","펭귄","이 정도면 훌륭합니다~~여행하면서 하루 묵기 좋아요 가격대는 약간 있는편입니다","2020.09.18."
"3","보름달","잠자기에 적당한 침대, 금-토 소음은 그닥 나지 않았음 에어컨 빵빵 코로나19로 인해 조식 x 전자레인지, 커피, 정수기는 사용가능","2020.07.20."
"5","유창훈","후기 작성하러 이집 다시 검색하였습니다 라마다호텔 투숙후 근처 맛집 찾아다녔으나 쉽지가 않았습니다 몇해전 속초에서 리뷰보고 찾아간 집에서 덩탱이를 쓴적이 있어서... 주변 마트직원분의 추천받아 가서 10만원 세트 메뉴 먹었는데 회도 신선하고 양도 많고 사장님도 아주 친절 하여 적극 추천합니다 정신없이 먹느라 사진을 못 찍은게 아쉽군요","2021.03.06."
"5","Gary","게+회 셋트 3명이서 먹고 물회랑 오징어회도 더 주시고 너무 잘 먹고갑니다.매운탕도 맛 나네요 가게가 넓어서 이 시국에 편하게 신경안쓰고 먹고, 친절하시고 담에 또 올게요.","2021.03.05."
"2","맛맛이","메뉴판 자연산 모듬회, 그냥 모듬회있는데, 자연산 小자 160000원인데, 그냥 모듬회랑 비교하면 대동소이함. 전번주 여수 디 오션리조트 근처 횟집에서 먹은 3인상 80000원과 비슷. 근데 여수 횟집이 주변안주가 훨씬 good. 그냥 모듬회 드시라는 뜻입니다.","2021.03.05."
"5","♥박연욱 David♥","최고예요","2020.11.13."
"5","성규","속초 자주 갑니다~ 언제나 라마다 앞 일출봉 들립니다~ 주말이라 사람이 좀 많아도 믿고 이 집으로 고고고~ 게 먹고 회먹고 밑반찬 리필해서 또 먹고!! 그리고 근처 등대길 배부르게 산책하면 대포항 미션 컴플릿!! 추천 합니다 #속초맛집 #대포항횟집","2020.11.13."
"2","diary","조금 아쉬워요","2018.01.18."
"4","유석산 融濟","이 지역은 한때 유명한 전국 학생들의 단체 수학여행 숙박촌이었다. 지금은 코로나 바이러스로 관광객의 발길이 뜸해지면서 예전의 활기는 없어진 상태. 그러나 금년(20년) 6월, 화끈한 아저씨로 주인이 바뀌면서 개보수를 단행, 월세방으로 일부 운영하며 모텔에 이용객들이 늘어나고 발걸음이 붐비는 중이다. 월방은 1인 35만, 2인 45만원 정도이고 1일 숙박은 ...더보기","2020.11.18."
"5","김종혁","음식이 정갈하고 깨끗합니다! 순두부도 너무 맛있고 다음에 꼭 다시 방문할게요!!","2021.01.03."
"5","KIMML","김치가 순두부에 잘 어울렸고 다른집 보다 고소한게 맛났습니다. 친절하신 점도 좋았어요! 다음에 재방문하려고 리뷰남겨놓습니다. 번창하세요!","2021.01.03."
"5","❤❤대가온족발❤❤","최고예요","2020.11.30."
"5","정희^^","담백하고 건강한 맛집이네요 총각김치만 빼고 김치. 배추무친거. 해초류반찬 등 리필해서 잘먹었습니다. 순두부 양이 쫌 많아서 밥은 많이 남겼네요. 밥은 쌀이 좋은듯. 간만에 맛있는 집 찾았네요. 잘먹고갑니다~","2020.11.23."
"5","정","두부 전골 정말 맛있어요  많이 자극적이지 않고 두부도 맛있어요! 로컬 맛집인거같아요 주위에서 일하시는 분들이 단체로 오셔서 밥 드시네요 ","2020.10.24."
"5","행복","반찬도 해장국도 무엇보다 밥이 맛있는 집","2020.11.18."
"5","8875","속초 갔다가 늦은밤까지 영업하는 음식점 발견 사막에 오아시스만난. 기분으로 들어가서  감자탕뚝배기 식혔는데 맛있어서 공기밥2개 해치웠습니다 ","2020.06.08."
"3","달팽이 안단테","늦은 시간.. 해장국.","2020.01.15."
"5","사과나무","맛있어요~ 속초여행갔다가 저녁먹고 아침도 먹었어요~ 반찬도 깔끔하고 친절하셨어요^^","2019.12.20."
"5","Senu","뚝배기감자탕 8000에 푸짐한 반찬과 김치가 맛있고 속초에 정말 몇 안되는 24시간 식당입니다.^^","2019.08.26."
"5","일","너무 좋은 효소찬과 나물 계절마다 변하는 약초찬이 신기하고 디톡스 하는 느낌을 받았습니다 요리에 대한 친절하신 설명 감사했습니다","2021.02.25."
"5","인생잼잼","맛있었어요!! 반찬은 대체로 초절임? 한것들이라 시큰달큰한데 괜찮았어요. 자취하느라 잘 못먹는 나물 종류 많아서 좋았어요!","2021.01.02."
"4","소소","정식먹었는데 음식하나하나 다 맛있었어요","2020.12.04."
"1","hjyou","먹지도 않은 사람들이 쓴 리뷰같은데, 확실한건지 모르겠네요. 남자분 정말 매너 없네요.","2020.11.02."
"5","박종만","오래되도 맛이 변하지 않는 곳이에요 앞으로도 변함없이 자리 지켜주세요","2020.10.29."
"3","킹옄","나름 깔끔하네요 그게다입니다. 주차장이 좀 멀리있는게 흠","2020.07.19."
"1","YoungminYu","바로밑에 노래방에서 오는 소리 및 복도소리 방음이 매우 열악함. 침구가 깨끗하지 않았으며 내부 시설에 비해 가격이 너무 비쌈.","2018.01.08."
"5","아름다운 날들","너무 깨끗해서 좋았어요 다음에 또갈게요","2016.09.04."
"1","마이콜","바가지 심함","2016.07.22."
"4","주민","무료로 족욕을 할 수 있어 좋음. 설악산 케이블카 타기 전/후에 들르기 좋다. 지역주민들이 더 많이 이용 하는 듯. 타올과 방석은 1000원에 대여할 수 있는데 사실 별 필요는 없음. 온천수는 그대로 말리는게 더 좋고... 스아실.. 타올 대여하시는 분 쪼꼼 불친절쓰... 벌레가 쪼꼼 떠있고 그렇긴 하니까 감안하시고 하셈. 주차장 들어가는곳을 인도 경계석 ...더보기","2020.07.17."
"5","긋데이","온천수라 따뜻하고 무료이용이라 너무 좋아요 주차도 무료 ","2020.07.09."
"1","이유리","관광객이랑 싸우려는건지 일을 하려는건지 구별을 못하는 사람이 있음.  다른 리뷰에 불친절하다는 얘기가 괜히 있는게 아님.  서비스 관련 강원도지사님께 건의가 필요할 정도","2020.05.27."
"1","Gil-!","내가 깔개 가져가서 쓰려고 하는데  못 쓰게 하고 빌리라는건 조금 아니지 않나? 개인 시설도 아니고 시에서 운영하는건데..","2020.05.21."
"4","최선생","따뜻한 온천물에 발을 담고 있노라면 걷기의 피로가 가시고 피부가 좋아지는 느낌. 깔개와 수건을 대여하며 1인당 3천원을 받음. 그런데 물에 벌레가 떨어져 죽으면 채로 건져주면 좋겠습니다.","2020.05.20."
"4","Jay","모듬물회를 먹었는데 쫄깃하고 양념도 맛있고 버스 타기 전 근처에 있어 들어 왔는데 생각외로 맛있었음. 반찬도 모두 깔끔하고 간도 딱 맞고 주인분도 친절하심. 이쁜 고앵이도 있고:)","2019.10.14."
"5","MFG","가자미물회","2019.07.21."
"3","왈리","홀에 고양이가 돌아다님 맛은 있음","2015.08.07."
"3","심동섭","황때찜 먹을만 해요 영탁막걸리 한잔 사장님 친절하신데 일하는 아줌마 처음 공깃밥 안시키고 나중에 주문하니 머라고 하네요 같이간 일행하고 기분잡침 어디든 불친절 종업원때문에 점수 마이너스 되네요","2020.06.28."
"1","맛집요정","넘나별로...  돈아까움... 진짜 비추...","2020.06.16."
"1","J H","감자전은 덜익혀서 나오고 물컵은 대충 행군건지 립스틱자국 남겨져 있더군요. 음식 왠만하면 돈아까워서 안남기는데 남겼습니다.","2020.01.06."
"1","H.C♡","3가지 음식 두부전골.황태찜.불고기백반  전골 너무 짜고 맛 없구요 나머지 음식은 집에서  해도 그 정도는 하겠네요   ","2019.08.17."
"1","ㄱ♡막돼먹은 순덕씨~♥","워터피아갔다가 배가 엄청고파   찾은맛집..  카카오맵추천으로 왔는데요..  맛이없습니다. 진정.. 배가고팟지만 정말 맛이 없었어요..  ㅡㅡ 직원분들은 뭐 딱히 불친절한것은 없습니다마.   음식의 맛이 양에비해  적고 맛도없고.. ㅉㅉ  실망입니","2019.08.17."
"2","거믄그림자","송림순대 가려다   맛있는녀석 방송했길레 들어갔는데...오징어순대는 단백한  맛은 있는데 내 입맛에는 송림순대가  더 맛있네요. 물회는  비린네가 약간 나네요. 서비스 미역국은 짜지만 맛있네요!","2021.02.21."
"5","mkim","오징어순대&먹물순대 포장해서 먹었는데 계란물에 발라 기름에 부치지 않고  찌는 방식인데 단백하고 맛있었습니다 (개인취향입니다) ","2021.02.07."
"3","행운동꿀주먹","맛녀석 보고 갔는데 오징어순대 살짝 실망쓰..","2021.02.02."
"2","최선을","집사람과 찾은 진양횟집.  괜찮은데...물회 생선비린내가 살짝....  맛은 반찬이 더 좋음  ㅎ","2021.01.20."
"2","비정상이용자","에잇","2020.12.13."
"3","ㅇ","보통이에요","2021.01.24."
"5","myunghee","언제나 가도 변함없는 곳 가격 바가지 없고 과장된 친절이나 불친절 없고 숙소침구며 대욕탕도 깨끗합니다 가까이 설악동도 있고 여러 곳의 접근성이 좋아요 특별한 목적없이 쉬러가기에 좋은곳입니다","2020.08.18."
"4","考え中","등산후 월요일 오전에 방문 물은 깨끗했음. 소박하니 옛날 목욕탕이 생각나서 좋았고., 내 발에 무좀이 있는데 다녀오고 난 후 80%사라짐 100%진심 다음에 재방문 의사 있음 약간 비릿한 냄새가 난거 빼고, 나름 괜찮았음.","2020.04.29."
"1","소나자매","진짜별로에요 온탕에 들어갈수없을정도로 떼랑각질이 둥둥떠있어요  애들이랑들어갔다가 샤워부스에서 씻고나왔네요  진짜 탕좀 깨끗하게해주세요 멀리서 온천물좋다구갔는데 너무하네요","2020.03.15."
"5","avo","온천 물이 진짜 좋음!!! 설악소공원 갔다가 들르면 좋은 온천이다 온천 좋아해서 국내 여기저기 온천 많이 다녔는데 물이 제일 좋은듯! 부들부들하고 . 시설은 신식은 아니고 오래됐지만 노후한 느낌이 아닌 옛스러운 느낌이고 깨끗함. 아쉬운 건 아이들 데리고는 가기 힘들 것 같다는 점. 온천탕이 총 3개인데 43도인 온탕 두 개 그리고 얼음장처럼 차가운 냉탕1개...더보기","2020.02.09."
"1","도느","날이추워 가족탕이용했는데 직원도 불친절하고 청결도가 너무 떨어지고 시설이 열악했어요 5층객실에 세면대도 막혀있고 변기와 온천탕이 한곳에 있고 온천탕도 너무 좁고 냉장고는 열자마자 구린내 나고 침대는 그냥 더블인지 너무 작고 위생상태도 믿음이 안가네요 당직인 남자직원도 표정과 말투가 너무 퉁명스럽고 불친절하네요 다신 안갈듯 합니다.","2021.02.02."
"5","젊은노인","온천 쵝오수질","2021.01.15."
"1","유지현","청결하고는 거리가 먼곳입니다.요즘에도 이런곳이 있네요.리뷰에 지져분하단 말이 많았는데 그래도 혹시나 했는데 역시나...침구류는 안바꾸나봐요?? 사진보시면 머리카락에.. 먼지.. 오래쓴듯한 꼬질꼬질함... 찝찝해서 혼났어요. 입구에 써진 청결 문구는 뭔가...싶어요. 요즘같은 시기에 방역은 제대로하는지 모르겠네요. 방 사진은 정말 잘찍어놨네요.실물은 작아요....더보기","2020.12.23."
"1","Kellain","방음 완전 최악. 위아래 떠드는 소리가 왜 들림?? 소리 지르는 것도 아니고 그냥 얘기하는 소리인데도 들림... 겉만 바꾸지 말고 속을 보강하던가 해야지 ㅉㅉ","2020.12.05."
"4","지롱","숙박과 온천을 할수 있는곳","2020.11.21."
"4","주민","무료로 족욕을 할 수 있어 좋음. 설악산 케이블카 타기 전/후에 들르기 좋다. 지역주민들이 더 많이 이용 하는 듯. 타올과 방석은 1000원에 대여할 수 있는데 사실 별 필요는 없음. 온천수는 그대로 말리는게 더 좋고... 스아실.. 타올 대여하시는 분 쪼꼼 불친절쓰... 벌레가 쪼꼼 떠있고 그렇긴 하니까 감안하시고 하셈. 주차장 들어가는곳을 인도 경계석 ...더보기","2020.07.17."
"5","긋데이","온천수라 따뜻하고 무료이용이라 너무 좋아요 주차도 무료 ","2020.07.09."
"1","이유리","관광객이랑 싸우려는건지 일을 하려는건지 구별을 못하는 사람이 있음.  다른 리뷰에 불친절하다는 얘기가 괜히 있는게 아님.  서비스 관련 강원도지사님께 건의가 필요할 정도","2020.05.27."
"1","Gil-!","내가 깔개 가져가서 쓰려고 하는데  못 쓰게 하고 빌리라는건 조금 아니지 않나? 개인 시설도 아니고 시에서 운영하는건데..","2020.05.21."
"4","최선생","따뜻한 온천물에 발을 담고 있노라면 걷기의 피로가 가시고 피부가 좋아지는 느낌. 깔개와 수건을 대여하며 1인당 3천원을 받음. 그런데 물에 벌레가 떨어져 죽으면 채로 건져주면 좋겠습니다.","2020.05.20."
"1","김병선심판위원!!","완젼별로고요. 호텔은 무신! 최하급 모텔이고, 그이하입니다. 민박집도 여기보다 좋을 듯! 급하게 잡긴 했지만, 이제껏 주말여행 중에 최악의 숙박장소였네요! 별하나도 아까워요. 특히, 침대도 스프링 다나가고, 한 쪽으로 기울어서 자다가 떨어졌네요ㅠㅜ","2020.11.15."
"1","푸르미","호텔이란 이름의 여관장... 내부 더럽고 어메니테 갖춰진것도 거진 없으며  청소상태불량 타원마져도 비치안되 직접 가질러감 25000원받음 맞음. 그이상 주고 묵지마세요","2020.08.21."
"1","카멜레온","호텔이람서 모텔보다 못함. 주말 3박에 500,000원 하우스키핑 안함, 샤워 수압 약하고 뜨거운 물 안 나올 때 있음 3nights for 500,000won.THE WORST NO HOUSE KEEPING. BAD SERVICE. ","2020.08.16."
"4","박윤덕","좋아요","2021.03.11."
"5","진주","안좋은 리뷰들이 간혹 있어서 걱정했는데 저는 다 만족했어요. 물회, 전복죽, 성게비빔밥 시켰는데 음식 다 정갈하게 나오고 맛도 좋았어요.  먹는 내내 창가자리 뷰도 너무 좋았어요.  직원분도 먹는법도 친절하게 알려주시고 기분좋게 다녀왔네요. 부모님 모시고 가기 좋아요. ","2021.03.07."
"5","이창희 흰수염고래","어제 강원도 여행갔다가 딸의 강력추천으로 갔었는데 왜 그렇게 사람들이 많이 있고 대기시간 길어도 먹으려고 기다리는지 음식을 먹으면서 몸과 입으로 느꼈습니다.    강원도가서 대게 4인 20만원대 먹는것보다 이 집에서 이것 저것 4인가족 10만원으로 해결하는게 가성비도 좋고 맛있고 만족스럽다는걸 느꼈습니다.    서울 강남점도 함 가 봐야 겠네요.","2021.03.01."
"3","myo","맛은 그냥 평범하게 맛있었어요 양은 가격에 비하면 좀 적어요 웨이팅하면서까지 먹을 맛은 아닌것같아요.. 그래도 뷰는 정말 좋았어요","2021.02.28."
"1","신당아재","돈 아까움  ","2021.02.22."
"3","KㆍHㆍJ","비수기라서 그런지 관리가 안 되어 있어서 호수에 쓰레기(비닐,스트르폼등..)가 둥둥 떠다니는데 오리는 그게 먹이 인줄 알고 먹고있어서 지나가면서 내가 속초를 괜히 왔나 싶었지만 그런 점만 빼면 괜찮은 곳인거 같다.","2021.01.17."
"4","용","좋아요","2020.10.01."
"4","깜","수변데크길 잘 돼있음 낮엔 설악산자락과 바닷빛이, 밤엔 야경도 멋짐","2020.09.23."
"3","홍홍홍","장마철 똥물뷰","2020.07.24."
"4","Already06","호수 둘레길이 데크라 걷기좋았어요. 다만 호수에 부유물이 많아 아쉽네요.","2020.07.13."
"5","배주","나만 알고싶은 곳..!","2021.02.06."
"5","홍태웅","캠핑 취사","2020.08.16."
"5","먹을려고 사는애","최고예요","2020.02.13."
"5","주모리언니","작지만 한적하고 깨끗하고 좋아요~~","2019.06.14."
"5","오민경","아담하고 물 맑고 예뻐요 감사합니다^^","2019.03.25."
"5","진미채","11번가에서 이시가리 먹었어요~ 속초니까 우럭이나 광어처럼 평소에 먹는 거 말고 다른 거 추천해달라 했구요. 이시가리 1마리 5만원이었는데 멍게 해삼 오징어 전부 서비스였습니다... 대박! 회뜨는 비용 5천원 상차림비 5천원 들구요 매운탕드시면 7천원추가래요~~ 투명한 이시가리 넘 맛있었어요 ^^ 다른 회센타들보다 훨씬 깨끗해요~!","2021.01.21."
"1","정녕","승진호(19호)는 정말 좋았습니다. 그런데 게 쪄주는 곳이랑 회 포장해주시는 곳의 서비스가 최악이었습니다. 시간도 안재보시고 사과 깎아드시면서 담소나 나누시고, 시간이 지났는 데도 포장이 처리가 되지 않아 여쭈어봤더니 그럴거면 왜 쪄가지고 가냐고 뭐라하시더군요. 옆가게에서는 사장님들끼리 싸움이나 하시고, 여러모로 최악이었습니다. 다신 안올거같네요.","2020.11.22."
"5","김정곤","속초여행시 회는 필수로 드실것입니다. 속초관광시장지하에서 비싸게 그리고 지하에서 드시는 것보다는 이장소를 추천합니다. 록초관광시장에서 모듬회 소가 120,000원인데 청호활어회센타에서는 모듬회 소가 30,000원에 야채.매운탕 20,000원으로 총 5만원입니다. 밑반찬에서 차이가나는냐 것도 아니구요...  청화활어회센타 2층에서 멋진 풍경을 바라보면서 즐기...더보기","2020.03.03."
"3","Zero형","이유는 모르지만 사람도 거의 없구 횟집도 몇집 없구 회 사려는데 너무 저렴하게 주려하구 뭔가 이상한곳이에요ㅋ 그래도 저렴하게 회랑 매운탕 먹구 왔어요","2019.08.15."
"1","hyun-5775","홍게무한리필 현수막 붙여서 관광객 끌어모아 홍게 무한리필 먹었는데 게살은 하나도 없고 짜디짠 바닷물이 다리속에 꽉차 바다물만 빨아먹다왔네요. 글구 3번 리필후 더달라니 종업원은 본척만척 20분이 지나도 리필을 안해줘 그냥 나왔는데 배가 넘고파 숙소에서 라면으로 배를 채웠네요. 속초시 수협조합 절대가지마세요.","2017.11.17."
"3","^..^","그냥 먹을만하다..","2021.02.28."
"1","강소리","지금 먹고있는데 음...황태정식에 나오는 황태구이가 너무 달아요. 젊은 사람이라 단맛 싫어하지 않는데 좀 많이 달아요. 전반적으로.. 썩 맛있진 않아요","2020.03.29."
"1","박철호","맛없어요","2019.11.23."
"1",",","밥은 전날한건지 맛도없고  공기에  반만 담겨져있고  공기밥 추가하면 천원 ㅜㅜ 황태구이는  설탕을  얼마나  쳐뿌렸는지  달아서  먹지도  못했어요  ","2019.07.16."
"5","Marco Kim","1.맛: 순두부전골은 맵지 않으나 시원한 맛이 일품 2.친절:주차부터 서빙하는 분들까지 친절하십니다","2019.06.07."
"3","...","주인분은 친절하시지만 청소 상태나 사진과 다른 숙소가 아쉽네요","2019.06.16."
"4","청풍명월","업주의 친절함, 깨끗한 환경, 넓은 주차장 조용함 등 모두 편안합니다.  ","2017.11.19."
"5","LYS","사장님도 친절하고 엄청 맛있었어요! 두부전골 강추해요 ㅎㅎ ","2020.12.06."
"5","댕이","너무 맛있고 밑반찬도 잘 나와요! 국물이 맑은 게 매운 거 못 드시는 분들이 먹기 좋을 거 같아요!","2020.06.03."
"5","최영철","음식좋고 주차장 넓고 친절합니다","2020.03.07."
"2","주풍","그냥 순두부는 먹을만 한데 매운 순두부는 추천하고 싶지 않네요 밑반찬이 약간 아쉽구요 이집만의 특징이 있겠으나  저는 같은 가격이면 김영애 할머니를...","2019.10.11."
"1","손","여기...주인이 바뀐거 같은데....맛이 달라요  예전의 비슷한 맛.","2019.05.18."
"5","沈 垣益(심원익)","일반 커피매장을 가면 커피의 쓴맛이 강한데 뮤토커피는 커피쓴맛이 강하지 않고 부드러움. ","2019.01.02."
"5","dusrn70","갓볶아내린커피의 향내음 음  ㅡ ㅡ 넘 넘 맛딧다  치즈케익한조각과  넘 넘 부드러운맛 매일 생각난다","2011.05.13."
"1","솔직하게리뷰"," 클래식함을 기대하고 갔지만 올드했고, 무엇보다 위생상태가 호텔이라고 하긴 애매할만큼 황당했음. 환기구와 스탠드 조명은 먼지 투성이, 화장실 타일은 바닥이 깨진 상태로 방치되어 있고, 습기때문이라지만 화장실 천장은 검은 곰팡이 얼룩이 얼룩덜룩... 곰팡이 냄새까지 났음. 방음은 말해뭐해 수준.. 옆 방 대화소리까지 모두 들리는 정도.   그리고 주차공간이 ...더보기","2021.03.02."
"1","루나킹","1. 직원 불친절  1) 모든 직원은 아니였지만, 체크인 도와줬던 여자직원 완전 별로 였음  - 체크인 시간(오후 3시) 보다 좀 일찍 도착했는데, 3시에 체크인 하실수 있다고만 앵무새처럼 반복함 (융통성 있게 좀 일찍 들어가게 하면 될텐데...) 그리고, 보통 그렇게 시간 뜨면 어디에 계시라고 라고 할만 한데 아무말도 없음   2) 시설 안내도 전혀 해주...더보기","2021.03.01."
"4","김성혜","정말 노후가 뭔지를 알려주는 호텔인데 그래서 더 좋네요 로비, 객실 복도마다 소중한 물품들이 가득하고 세월의 흔적을 찾아볼 수 있어서 재밌었어요 아직도 소중하게 관리되고 있고 직원분들 한분 한분 다 너무 친절해서 기분 좋은 경험이었습니다~ 객실 커텐을 치면 귀곡 산장에 온 것 같고 요즘 세상이랑 차단 된 기분이 들어서 재밌는 경험이었어요 ㅋㅋㅋ","2021.01.01."
"4","신성환","22~23일 2박했습니다 코로나 땜시 조금 여유로웠는데 아주 좋았습니다 직원들도 친절하고~특히 23일 저녁 애비로드에서 담당자인 정주임의 친절한 서비스는 정말 고마웠습니다 다시 한 번 가고 싶네요~정주임! 고마워요","2020.12.25."
"4","R","작년 이맘때 갔었는데 정말 좋았습니다 풍경은 두말할 필요도 없고 호텔 안에서 시간을 보내도 지루하지 않았고 조식도 좋았습니다 그래서 또 예약 완료 눈이 마구 오면 금상첨화 ㅎ","2020.11.26."
"5","hjyou","스끼다시 잘 나와요~!!!!!!!!!!!!!!!!!!!!!!!!!!!!!!! 회 당근 맛있습니다!","2021.01.11."
"5","예다움","단체들어가기 평가좋은 횟집.스끼다시의 다양함과 회의 풍성한 양을 다 만족시킴 이시가리(돌가자미회 맛보시라","2021.01.05."
"5","ღ","자연산 회 진짜 드세요 달고 맛있어요!!대자리(170000원)시켰는데 4명에서 배부르게 먹었어요 매운탕도 옆에서 미리 끓여주셔서 바로 먹을수있게 해주셔서 편하게 먹었어요  스끼다시도 다 괜찮고 물회도 서비스로 주시고 오징어회도 그냥 주셔서 잘먹었습니다  친절하고 다 만족한 식사하고 나왔어요! 다시 가고싶은곳이에요!","2021.01.03."
"5","업데이트","개인적으로 속초를 거리가 별로 안멀어서 1년에 2~3번은 감 정말 여러횟집을 다녔지만.. 솔직히 맛은 다 거기서 거기임 내가 중요시하는건 이모님들 친절함? 그리고 청결한거랑 이렇게 보는데 코리아가 그중 제일 좋음","2020.11.09."
